<?xml version="1.0" encoding="utf-8"?>

<!DOCTYPE table
  SYSTEM "../../../../../../../lib/tools/dtd/DatabaseTableDefinition2.0.dtd">
<table>
   <table-name>QuotasMap</table-name>
   <schema>
      <schema-major>1</schema-major>
      <schema-minor>0</schema-minor>
   </schema>
   <column>
      <column-name>userOrGroupId</column-name>
      <column-type>INTEGER</column-type>
      <column-size>MEDIUM</column-size>
   </column>
   <column>
      <column-name>quotaSize</column-name>
      <column-type>INTEGER</column-type>
      <column-size>MEDIUM</column-size>
      <not-null empty="disallowed"/>
   </column>
   <index>
      <column-name>userOrGroupId</column-name>
   </index>
</table>